[
  {
    "id": 1,
    "name": "Solane Santa Cruz de Tenerife",
    "manufacturer_id": 12,
    "city": "Santa Cruz de Tenerife",
    "province": "Santa Cruz de Tenerife",
    "address": "Polígono Industrial Norte, 45",
    "postal_code": "38049",
    "phone": "+34 922 551 625",
    "opened_at": "2004-01-21"
  },
  {
    "id": 2,
    "name": "Marova Madrid",
    "manufacturer_id": 9,
    "city": "Madrid",
    "province": "Madrid",
    "address": "Plaza de Cervantes, 54, 2º D",
    "postal_code": "28014",
    "phone": "+34 918 881 476",
    "opened_at": "2020-09-04"
  },
  {
    "id": 3,
    "name": "Marova Madrid 8",
    "manufacturer_id": 9,
    "city": "Madrid",
    "province": "Madrid",
    "address": "Polígono Industrial Los Olivos, 24",
    "postal_code": "28001",
    "phone": "+34 910 174 589",
    "opened_at": "2020-12-24"
  },
  {
    "id": 4,
    "name": "Altaria Las Palmas de Gran Canaria",
    "manufacturer_id": 1,
    "city": "Las Palmas de Gran Canaria",
    "province": "Las Palmas",
    "address": "Calle Serrano, 62",
    "postal_code": "35063",
    "phone": "+34 928 783 663",
    "opened_at": "2017-07-02"
  },
  {
    "id": 5,
    "name": "Kestrel Albacete",
    "manufacturer_id": 8,
    "city": "Albacete",
    "province": "Albacete",
    "address": "Plaza de Rosalía de Castro, 8, 6º D",
    "postal_code": "02041",
    "phone": "+34 967 450 113",
    "opened_at": "2015-11-21"
  },
  {
    "id": 6,
    "name": "Velmar Santa Cruz de Tenerife",
    "manufacturer_id": 2,
    "city": "Santa Cruz de Tenerife",
    "province": "Santa Cruz de Tenerife",
    "address": "Avenida de la Estación, 32, 2º Izq.",
    "postal_code": "38070",
    "phone": "+34 922 384 657",
    "opened_at": "2005-11-22"
  },
  {
    "id": 7,
    "name": "Belmonte Terrassa",
    "manufacturer_id": 7,
    "city": "Terrassa",
    "province": "Barcelona",
    "address": "Polígono Industrial Este, 47",
    "postal_code": "08023",
    "phone": "+34 930 703 334",
    "opened_at": "2013-03-04"
  },
  {
    "id": 8,
    "name": "Nordika Madrid",
    "manufacturer_id": 4,
    "city": "Madrid",
    "province": "Madrid",
    "address": "Plaza de la Iglesia, 145, 5º D",
    "postal_code": "28052",
    "phone": "+34 912 938 678",
    "opened_at": "2020-06-06"
  },
  {
    "id": 9,
    "name": "Nordika Granada",
    "manufacturer_id": 4,
    "city": "Granada",
    "province": "Granada",
    "address": "Camino de San José, 160",
    "postal_code": "18037",
    "phone": "+34 958 902 604",
    "opened_at": "2004-07-18"
  },
  {
    "id": 10,
    "name": "Aurion Barcelona",
    "manufacturer_id": 6,
    "city": "Barcelona",
    "province": "Barcelona",
    "address": "Calle de Andalucía, 108, 2º C",
    "postal_code": "08055",
    "phone": "+34 931 588 304",
    "opened_at": "2004-03-01"
  },
  {
    "id": 11,
    "name": "Kestrel Cádiz",
    "manufacturer_id": 8,
    "city": "Cádiz",
    "province": "Cádiz",
    "address": "Calle de la Constitución, 63",
    "postal_code": "11035",
    "phone": "+34 956 456 336",
    "opened_at": "1996-06-04"
  },
  {
    "id": 12,
    "name": "Velmar Madrid",
    "manufacturer_id": 2,
    "city": "Madrid",
    "province": "Madrid",
    "address": "Polígono Industrial Los Olivos, 35",
    "postal_code": "28080",
    "phone": "+34 911 711 989",
    "opened_at": "2013-08-04"
  },
  {
    "id": 13,
    "name": "Velmar Málaga",
    "manufacturer_id": 2,
    "city": "Málaga",
    "province": "Málaga",
    "address": "Calle Serrano, 55, 5º A",
    "postal_code": "29021",
    "phone": "+34 952 334 344",
    "opened_at": "2009-04-21"
  },
  {
    "id": 14,
    "name": "Ondara A Coruña",
    "manufacturer_id": 10,
    "city": "A Coruña",
    "province": "A Coruña",
    "address": "Calle de Galicia, 120, 1º D",
    "postal_code": "15069",
    "phone": "+34 981 006 640",
    "opened_at": "1998-10-22"
  },
  {
    "id": 15,
    "name": "Solane Sabadell",
    "manufacturer_id": 12,
    "city": "Sabadell",
    "province": "Barcelona",
    "address": "Polígono Industrial Sur, 20",
    "postal_code": "08034",
    "phone": "+34 939 431 815",
    "opened_at": "2017-04-29"
  },
  {
    "id": 16,
    "name": "Ondara Madrid",
    "manufacturer_id": 10,
    "city": "Madrid",
    "province": "Madrid",
    "address": "Avenida de San José, 66",
    "postal_code": "28005",
    "phone": "+34 915 079 756",
    "opened_at": "2002-09-06"
  },
  {
    "id": 17,
    "name": "Nordika Madrid 2",
    "manufacturer_id": 4,
    "city": "Madrid",
    "province": "Madrid",
    "address": "Polígono Industrial Norte, 2",
    "postal_code": "28058",
    "phone": "+34 917 190 534",
    "opened_at": "2006-09-25"
  },
  {
    "id": 18,
    "name": "Belmonte Madrid",
    "manufacturer_id": 7,
    "city": "Madrid",
    "province": "Madrid",
    "address": "Calle del Ebro, 87, 2º B",
    "postal_code": "28042",
    "phone": "+34 914 745 641",
    "opened_at": "2021-12-11"
  },
  {
    "id": 19,
    "name": "Belmonte Madrid 3",
    "manufacturer_id": 7,
    "city": "Madrid",
    "province": "Madrid",
    "address": "Polígono Industrial Norte, 50",
    "postal_code": "28076",
    "phone": "+34 914 105 601",
    "opened_at": "2006-06-05"
  },
  {
    "id": 20,
    "name": "Aurion Albacete",
    "manufacturer_id": 6,
    "city": "Albacete",
    "province": "Albacete",
    "address": "Ronda Serrano, 21, 8º C",
    "postal_code": "02066",
    "phone": "+34 967 910 416",
    "opened_at": "2018-08-14"
  },
  {
    "id": 21,
    "name": "Altaria Barcelona",
    "manufacturer_id": 1,
    "city": "Barcelona",
    "province": "Barcelona",
    "address": "Carrer de San Juan, 91, 3º Izq.",
    "postal_code": "08062",
    "phone": "+34 938 701 495",
    "opened_at": "2020-10-25"
  },
  {
    "id": 22,
    "name": "Solane Madrid",
    "manufacturer_id": 12,
    "city": "Madrid",
    "province": "Madrid",
    "address": "Avenida de Aragón, 23",
    "postal_code": "28033",
    "phone": "+34 917 915 449",
    "opened_at": "1995-06-25"
  },
  {
    "id": 23,
    "name": "Nordika Sevilla",
    "manufacturer_id": 4,
    "city": "Sevilla",
    "province": "Sevilla",
    "address": "Polígono Industrial Norte, 35",
    "postal_code": "41049",
    "phone": "+34 954 184 491",
    "opened_at": "1996-10-26"
  },
  {
    "id": 24,
    "name": "Ondara Málaga",
    "manufacturer_id": 10,
    "city": "Málaga",
    "province": "Málaga",
    "address": "Calle del Ebro, 153, 9º Dcha.",
    "postal_code": "29033",
    "phone": "+34 952 813 473",
    "opened_at": "2018-07-13"
  },
  {
    "id": 25,
    "name": "Belmonte Barcelona",
    "manufacturer_id": 7,
    "city": "Barcelona",
    "province": "Barcelona",
    "address": "Calle de las Flores, 120",
    "postal_code": "08056",
    "phone": "+34 933 011 144",
    "opened_at": "2004-12-31"
  },
  {
    "id": 26,
    "name": "Altaria Gijón",
    "manufacturer_id": 1,
    "city": "Gijón",
    "province": "Asturias",
    "address": "Polígono Industrial Oeste, 54",
    "postal_code": "33079",
    "phone": "+34 985 423 361",
    "opened_at": "1998-04-12"
  },
  {
    "id": 27,
    "name": "Solane Málaga",
    "manufacturer_id": 12,
    "city": "Málaga",
    "province": "Málaga",
    "address": "Paseo de la Libertad, 156, 7º Dcha.",
    "postal_code": "29017",
    "phone": "+34 952 862 721",
    "opened_at": "2016-12-14"
  },
  {
    "id": 28,
    "name": "Ondara Madrid 6",
    "manufacturer_id": 10,
    "city": "Madrid",
    "province": "Madrid",
    "address": "Calle de San José, 46",
    "postal_code": "28041",
    "phone": "+34 910 244 767",
    "opened_at": "2008-06-05"
  },
  {
    "id": 29,
    "name": "Solane Oviedo",
    "manufacturer_id": 12,
    "city": "Oviedo",
    "province": "Asturias",
    "address": "Calle de la Iglesia, 157, 7º D",
    "postal_code": "33041",
    "phone": "+34 985 787 203",
    "opened_at": "1995-10-05"
  },
  {
    "id": 30,
    "name": "Aurion Salamanca",
    "manufacturer_id": 6,
    "city": "Salamanca",
    "province": "Salamanca",
    "address": "Calle de las Acacias, 146, 5º Izq.",
    "postal_code": "37021",
    "phone": "+34 923 420 902",
    "opened_at": "2005-07-13"
  }
]
